Citizen_ID,Area_Sector,Issue_Type,Complaint_Text,Severity_Level,Reported_Time,Resolution_Time_Hours,Assigned_Department,Satisfaction_Rating,Followup_Required,Latitude,Longitude,AI_Priority_Score
C1321,B2,Pollutn,Movement occur fly morning art would dog newspaper rock though address song mouth realize pretty get.,Lo,24-09-2025 19:08,108,SmartWifiDept,5,Yes,19.172201,73.025173,0.43
C1322,B1,Garbge,Whose maybe mission as place black home run price case response decision at religious hand.,Med,07-06-2025 10:06,75,Road Dept,,No,19.220206,73.032199,0.71
C1323,C1,Pothl,Billion believe easy affect business fear article foreign.,,23-07-2025 11:09,42,Clean Dept,2,Yes,19.272243,73.060908,0.25
C1324,D1,Stret Light,Player page value often technology attack sometimes may nearly sport reach statement strategy finally.,Lo,16-10-2025 03:16,2,SmartWifiDept,2,Yes,19.237743,73.078207,0.67
C1325,D2,Garbge,Which election allow head fly section reason prove design skill nothing information oil good east.,Lo,30-03-2025 20:14,48,Road Dept,2,No,19.13212,72.869204,0.67
C1326,B2,Watr,Risk clear month face system hour beat cover instead old Mrs.,Med,04-09-2025 14:58,,Elect Dept,4,No,19.200016,72.855622,1
C1327,B2,Garbge,Loss necessary design style base drop stock police floor.,Hi,14-03-2025 22:00,99,SmartWifiDept,2,No,19.277807,73.065887,0.1
C1328,B1,Watr,Magazine fire hit ball five a end executive carry plant worker your involve social.,Lo,21-09-2025 21:47,115,Elect Dept,,Yes,19.15232,72.917004,0.38
C1329,A2,WiFiIssu,Read cover area at however one season view color.,Med,03-11-2025 03:07,73,Elect Dept,4,Yes,19.226008,72.81208,0.62
C1330,B2,Pollutn,Participant total free raise ground meeting clear pretty forget name open week affect boy base.,Lo,13-05-2025 22:50,44,Clean Dept,4,No,19.000641,73.06976,0.6
C1331,C1,WiFiIssu,Ground against speech cup pay that take begin well type should civil individual hour.,Med,04-04-2025 20:39,,Road Dept,1,Yes,19.021105,72.827293,0.55
C1332,A1,Garbge,Well part better career around might that poor idea head.,Hi,17-01-2025 16:58,117,Watr Dept,,Yes,19.280523,72.812833,0.04
C1333,C1,Pothl,Learn success camera personal throughout game entire.,Med,16-10-2025 01:32,57,Clean Dept,2,No,19.205553,72.866621,0.87
C1334,C2,Pollutn,Today run series society wonder religious read hold possible west day white ground break.,Hi,13-04-2025 04:33,78,Elect Dept,2,No,19.000509,72.963875,0.92
C1335,B1,WiFiIssu,Long watch according firm benefit career few author teach better security trip.,Lo,15-09-2025 19:20,15,Clean Dept,1,No,19.231044,72.874319,0.92
C1336,A2,Watr,Couple local agent direction little natural leg range involve direction also third.,Hi,08-05-2025 13:54,114,,3,No,19.222542,72.983525,0.73
C1337,B1,Trafic,Ago experience peace quality agreement teach defense meeting spend garden head.,Critcal,27-05-2025 02:05,86,Elect Dept,2,No,19.110166,73.048223,0.3
C1338,A1,Trafic,Fast pay after control religious couple line section look near present professor send.,Med,05-10-2025 17:22,72,Watr Dept,10,No,19.064711,72.884093,0.66
C1339,C2,Watr,Free whom test drive likely less try.,Lo,02-12-2025 23:22,71,,1,Yes,19.299349,72.835052,0.61
C1340,C1,Pothl,Look prevent control budget commercial either receive company a.,Med,18-10-2025 10:14,61,Clean Dept,5,No,19.261421,72.808809,0.52
C1341,D1,Pothl,Measure network size strategy turn direction against lead recent early size.,Lo,18-11-2025 08:13,43,Road Dept,,No,19.248544,72.831816,0.86
C1342,C1,WiFiIssu,Cut amount anyone as enter door result knowledge walk sign phone.,Hi,27-06-2025 08:24,3,Elect Dept,3,Yes,19.069324,72.815428,0.72
C1343,C2,Pothl,Technology case with yard individual forget military seven physical media church large table.,Med,08-04-2025 17:37,106,Watr Dept,,No,19.133216,73.03894,0.84
C1344,A2,Watr,Only left dinner person arrive number happy knowledge water them or up nice water.,Med,09-03-2025 01:42,102,Watr Dept,3,No,19.183451,72.847424,0.46
C1345,C2,WiFiIssu,City relationship push could call board opportunity time member rule be several.,Critcal,31-08-2025 17:55,10,Elect Dept,5,No,19.085658,73.042357,1
C1346,C1,Pollutn,Plan issue thing war professional concern financial knowledge right be dinner matter.,Lo,22-01-2025 22:09,63,Clean Dept,3,No,19.145624,72.929884,0.22
C1347,D2,WiFiIssu,What single big improve financial safe over cover often top candidate.,Lo,24-09-2025 01:33,108,Road Dept,3,Yes,19.25292,73.026937,0.73
C1348,C1,Stret Light,Article economic option somebody return property capital sure ten.,Lo,02-12-2025 16:48,117,Clean Dept,,Yes,19.280306,72.906706,0.45
C1349,D1,Watr,Key a choice use time American often must some reason data natural his direction shake.,Med,29-03-2025 14:55,7,Clean Dept,4,Yes,19.133994,72.839645,0.45
C1350,D2,Pollutn,Take success cost back drive wait art.,Critcal,11-02-2025 11:33,91,Elect Dept,2,No,19.087077,73.096423,0.37
C1351,C1,Pothl,Really likely television four agency forget office.,Lo,21-03-2025 16:44,103,Road Dept,4,No,19.293907,73.086368,0.65
C1352,C1,Watr,Past history trouble bed among we wear require piece discuss.,Lo,13-04-2025 19:03,71,Elect Dept,3,No,19.205443,73.053241,0.56
C1353,B2,WiFiIssu,Discussion region everything current manager reveal together base.,,28-07-2025 05:58,116,,1,No,19.260024,72.968461,0.91
C1354,B1,Pollutn,Focus manage international like reduce beyond cover several natural energy police boy whom season manager.,Critcal,13-08-2025 18:56,25,SmartWifiDept,,No,19.263038,73.070106,0.15
C1355,D1,Garbge,Hope particularly action market information establish three thought example type.,Hi,10-09-2025 22:56,,Clean Dept,1,No,19.211215,73.042667,0.87
C1356,B1,Watr,Coach computer example few style something artist time Mr.,,05-03-2025 11:19,6,Clean Dept,,Yes,19.041908,73.057569,0.84
C1357,B2,Pothl,Program author arm second let activity single professor move while sometimes itself look end.,Hi,24-04-2025 23:44,47,Clean Dept,1,Yes,19.2789,72.896517,0.62
C1358,D2,Stret Light,Table security deep experience then crime dark brother for serve fly know check production house.,Hi,04-07-2025 23:00,38,Road Dept,4,Yes,19.162598,72.872975,0.58
C1359,D2,Pollutn,Score step or deal report local deep class nearly north yard.,Critcal,27-03-2025 09:05,999,Elect Dept,5,No,19.026101,72.83667,0.86
C1360,B2,Trafic,Consumer radio exactly prevent kid east discussion institution manager represent my seven start successful.,,24-01-2025 14:07,1,,1,No,19.01374,72.913343,0.07
C1361,D1,Watr,Discover part game thank measure artist either source sort pull kind contain report perform president.,Med,08-03-2025 12:15,70,Watr Dept,2,No,19.279411,73.064655,0.03
C1362,C2,Watr,Themselves kitchen financial plan modern sure image nothing art off.,Critcal,27-11-2025 22:47,80,Road Dept,2,Yes,19.081863,73.059017,0.9
C1363,A2,Stret Light,Perform heavy try become wait wish Democrat difference its parent throughout bring.,Med,10-11-2025 01:47,74,Clean Dept,3,Yes,19.244305,73.069065,0.2
C1364,D1,Garbge,Ever another window possible TV speech forget me majority training seven film town.,Hi,05-01-2025 16:50,88,Elect Dept,3,Yes,19.204879,73.026742,0.86
C1365,A2,Garbge,Expect than huge mother in success cold American parent dinner since put.,Hi,05-12-2025 17:53,83,,1,Yes,19.201299,72.994326,0.06
C1366,A1,Watr,Father poor law easy half worry six cold name thus throughout baby billion news.,Hi,25-07-2025 04:21,88,SmartWifiDept,3,No,19.139602,72.908229,0.69
C1367,A2,Watr,Doctor from yeah level rich cold follow movie offer minute center course thought.,Hi,15-06-2025 03:05,95,Watr Dept,4,No,19.207518,72.94735,0.98
C1368,A2,Trafic,Yes bring west try issue floor from shake.,,17-11-2025 03:28,101,Clean Dept,5,Yes,19.193192,72.890138,0.68
C1369,B2,Watr,Pm strong whatever fact consumer stage really check far nearly list than teach attention.,Hi,18-01-2025 02:13,35,Elect Dept,2,Yes,19.106558,73.092961,0.36
C1370,C2,Garbge,Difference half base raise wish up although energy stand need despite.,Lo,16-05-2025 16:16,94,SmartWifiDept,3,No,19.192771,72.806684,0.59
C1371,B2,Trafic,Amount draw if reality tell easy meet yeah shake thousand give cut expect they sing.,Critcal,25-09-2025 22:34,68,SmartWifiDept,2,Yes,19.002407,72.958632,0.71
C1372,D2,Garbge,Visit born special state officer statement Mrs cup yard record marriage window run nice seem shoulder.,Med,02-06-2025 23:01,39,SmartWifiDept,2,Yes,19.114769,72.883961,0.8
C1373,C1,WiFiIssu,Until have sign do bring future individual ability significant physical however opportunity continue officer executive.,Critcal,30-08-2025 09:11,79,Road Dept,3,Yes,19.265927,73.067385,0.87
C1374,B1,Watr,Rich speech adult media nearly old society forget type.,,31-07-2025 18:14,61,SmartWifiDept,3,No,19.084509,72.927597,0.41
C1375,C1,Watr,Red follow it miss mention administration effect require including gas next pull course wide.,Critcal,14-04-2025 07:48,115,Clean Dept,2,Yes,19.254923,72.864372,0.32
C1376,B1,Trafic,Early reveal city rise own good exist deep action act cultural why bill character.,Critcal,21-09-2025 04:26,84,Watr Dept,2,No,19.231309,72.804367,0.71
C1377,A1,Stret Light,Including why energy respond open instead to class ago.,Lo,15-09-2025 10:58,29,SmartWifiDept,3,No,19.216312,72.956402,0.26
C1378,D2,Trafic,Western career manager big tell political because apply catch oil individual so change result food lawyer.,Lo,06-01-2025 04:46,61,Watr Dept,1,Yes,19.244985,73.086055,0.73
C1379,C1,Pollutn,Style white idea ground success world listen mention court those.,Hi,22-11-2025 04:30,,Road Dept,4,Yes,19.243216,73.079216,0.84
C1380,D2,Garbge,Green win power possible well treat strategy cover hear.,Lo,01-10-2025 01:36,24,Clean Dept,1,No,19.154317,73.064249,0.69
C1381,B1,Garbge,Drug million prepare buy national experience under.,Lo,14-10-2025 21:48,97,Watr Dept,5,Yes,19.023407,73.014851,0.99
C1382,C2,Garbge,Off radio behind ahead information side population trial.,,26-03-2025 01:20,29,Elect Dept,4,No,19.187199,72.946577,0.47
C1383,C1,WiFiIssu,Beyond always area partner key staff billion maintain half ahead.,Med,21-05-2025 22:42,2,Watr Dept,5,Yes,19.200479,73.010316,0.05
C1384,C1,Pollutn,Sister population drug seem away machine my central record the space anyone might agreement.,Lo,01-12-2025 10:53,68,,5,Yes,19.062995,73.073463,0.43
C1385,D1,Watr,Green off consumer benefit poor enjoy ground life apply list fly little.,Med,18-08-2025 10:54,101,Clean Dept,4,No,19.265961,72.895579,0.93
C1386,B1,Stret Light,Necessary need then music growth choice game local third away who compare operation name laugh.,Hi,09-01-2025 13:30,93,Elect Dept,1,Yes,19.03114,72.894099,0.89
C1387,A1,Pothl,Everything perform yard yet western discussion guy skin drop drug can.,Critcal,10-02-2025 21:37,114,Clean Dept,4,Yes,19.032706,72.936314,0.87
C1388,B2,Watr,Fact news reach so cost trouble range official hope.,,06-09-2025 18:28,,SmartWifiDept,3,No,19.294161,72.833699,0.26
C1389,A1,Garbge,Clearly of language set different sport couple main send teach task heavy.,Critcal,10-10-2025 05:04,84,Road Dept,3,No,19.001333,73.074708,0.13
C1390,B1,Trafic,Good degree building hour identify agency five water half.,,31-05-2025 00:54,71,Watr Dept,2,Yes,19.058314,72.874542,0.22
C1391,B2,Watr,World now task art sort far laugh charge several.,Med,16-01-2025 14:52,999,SmartWifiDept,5,Yes,19.015551,72.958462,0.41
C1392,D2,Pothl,Little budget edge prepare sure member identify attack.,Med,10-05-2025 19:52,82,Road Dept,5,No,19.079494,72.816017,0.73
C1393,B1,Pothl,Station window board bill scientist between especially security management.,Critcal,05-07-2025 11:44,,Road Dept,,Yes,19.14203,72.821383,0.75
C1394,A2,Stret Light,Condition practice agreement avoid chance economy how politics develop what girl surface.,Lo,16-03-2025 16:04,31,Road Dept,,Yes,19.196396,72.908804,0.85
C1395,C2,Garbge,Cell customer bag plan necessary body maintain almost keep along.,Critcal,18-02-2025 08:33,,SmartWifiDept,4,Yes,19.265009,72.889133,0.6
C1396,C1,Trafic,Soldier join follow subject down again wish can degree knowledge issue north of.,,20-11-2025 16:44,,Clean Dept,4,No,19.22472,73.088031,0.23
C1397,D2,Pothl,Themselves once idea seven prevent late imagine exactly security.,Lo,24-02-2025 00:29,18,,3,Yes,19.155587,72.91879,0.63
C1398,A2,Pothl,Area ten voice total listen series herself test itself tend yard may all service how administration.,Lo,09-05-2025 13:52,47,Elect Dept,4,No,19.041539,72.914479,0.37
C1399,C2,Watr,True man thus industry data drop little movement college.,Hi,04-03-2025 15:56,10,Road Dept,2,No,19.061488,73.098556,0.28
C1400,B2,Stret Light,Young hair where wife result walk arm lot.,Med,24-06-2025 03:35,87,Clean Dept,2,No,19.072335,72.935614,0.24
C1401,B1,Garbge,Us experience herself assume not party interesting those many window smile development risk modern matter.,Critcal,26-11-2025 08:52,51,,3,No,19.144573,72.97777,0.42
C1402,C1,Garbge,Contain cost mother standard realize doctor my fight finish.,Lo,04-11-2025 08:26,41,Road Dept,2,Yes,19.183206,72.962214,0.51
C1403,B2,Garbge,Film how star several could although source feel get itself skin him glass international box.,Lo,25-08-2025 07:40,96,Elect Dept,4,No,19.166014,73.066666,0.86
C1404,A1,Pothl,Child avoid response main idea house among several open share.,Lo,19-01-2025 08:01,70,Elect Dept,3,Yes,19.21185,73.098703,0.54
C1405,C2,Stret Light,Rise son whole show condition newspaper focus off large everyone land fund charge as tough.,Hi,22-06-2025 02:47,105,Elect Dept,2,No,19.152166,73.030173,0.79
C1406,D2,Pollutn,Others about next vote follow religious house view process tough window budget run best.,Med,12-10-2025 22:22,,Road Dept,2,Yes,19.042754,72.9526,0.57
C1407,D1,Watr,Feeling this success former cultural five option size six speak impact use business.,Critcal,06-12-2025 23:47,62,Elect Dept,3,Yes,19.155363,72.846909,0.69
C1408,D1,Watr,Will offer south perform ball serve wall with.,Lo,23-05-2025 18:56,81,Elect Dept,2,No,19.030064,72.962314,0.42
C1409,C2,WiFiIssu,Laugh spring price trade us nor service skill support kitchen hair over fall.,Hi,01-01-2025 23:06,36,Road Dept,4,Yes,19.121836,72.941409,0.05
C1410,D2,Stret Light,Worry consumer article open key own model process let church market.,Med,14-02-2025 21:06,36,Road Dept,3,No,19.052273,73.091476,0.72
C1411,D1,Watr,Factor threat either do control change everybody try positive building movie.,,29-10-2025 06:45,81,,2,No,19.022045,73.074022,0.54
C1412,B2,Pothl,Care stop policy whatever yes yes evidence reason song military doctor discuss whole fact.,Lo,28-04-2025 00:49,38,,5,No,19.180371,72.834564,0.42
C1413,D1,WiFiIssu,Year born change history bag chair compare indicate end.,,30-10-2025 00:08,72,SmartWifiDept,,Yes,19.162258,73.073714,0.13
C1414,A2,Stret Light,Face to know over always spring avoid begin society.,Med,30-08-2025 03:34,120,Road Dept,,Yes,19.013995,72.846406,0.98
C1415,C1,Pollutn,Card have growth nice pressure throw reality while our news.,Lo,25-08-2025 12:35,82,Elect Dept,5,No,19.14972,72.981294,0.14
C1416,C2,Trafic,Model former sister her say while far recognize nearly executive indicate right contain hour.,Med,29-01-2025 11:08,33,SmartWifiDept,2,Yes,19.134949,72.936353,0.39
C1417,C2,Watr,Performance security also machine also person nor these field hold common whatever.,Med,24-11-2025 10:57,9,Watr Dept,4,Yes,19.016496,73.08612,0.7
C1418,D2,Stret Light,Identify relate skill style amount officer those add ability strong figure.,Hi,26-05-2025 01:09,93,Elect Dept,4,Yes,19.257192,72.98334,0.57
C1419,C2,Trafic,Eat brother fast bar spring without north less party city base.,Hi,05-04-2025 00:50,,Road Dept,1,No,19.022603,73.000752,0.39
C1420,B1,Watr,Industry leave fire people bag sister number.,Critcal,07-11-2025 07:32,39,Watr Dept,3,No,19.118545,72.876638,0.75
C1421,B2,Watr,Should discover training bed traditional hold method new we.,,02-11-2025 16:52,71,Watr Dept,1,No,19.210397,72.956334,0.3
C1422,C1,Stret Light,Large test kitchen majority father popular loss standard agency wonder people agent follow them.,,06-05-2025 12:15,51,Clean Dept,1,No,19.121006,72.836963,0.6
C1423,B1,Garbge,Page tax sport wonder detail project recognize business address whose.,Hi,29-11-2025 08:48,107,,4,No,19.054844,72.908073,0.69
C1424,B1,Pollutn,Keep choose under face radio whole candidate fast often player defense professional star music.,Med,01-08-2025 11:31,115,SmartWifiDept,5,Yes,19.288033,72.958212,0.68
C1425,C1,Watr,Reality this more could century difficult expert lose land defense provide million lot third.,Hi,17-06-2025 09:55,15,SmartWifiDept,2,No,19.21798,72.966469,0.82
C1426,D2,Pollutn,Wife source off amount we war first may move look through cell over interesting let.,Med,05-05-2025 08:38,38,Road Dept,4,Yes,19.212312,72.978953,0.93
C1427,D2,Trafic,Million security just son upon technology key section follow interview.,Lo,25-09-2025 20:06,33,Elect Dept,3,No,19.039581,72.863357,0.73
C1428,C1,Pothl,In but sound myself modern mission baby.,Critcal,14-09-2025 14:29,40,Watr Dept,1,No,19.134176,72.931233,0.46
C1429,B1,Trafic,Sister Mrs staff concern fall fear determine such it already grow skin technology the such something.,,04-07-2025 19:46,44,Elect Dept,3,Yes,19.124232,73.055718,0.87
C1430,D1,Pothl,Race standard person capital become hope business east ready current lawyer south.,Hi,05-09-2025 21:25,18,SmartWifiDept,,Yes,19.225652,72.864332,0.19
C1431,A1,Trafic,Claim serve job close eat somebody second thank local look.,Lo,04-12-2025 00:11,83,Watr Dept,,No,19.068028,73.009369,0.12
C1432,A1,Stret Light,Gun cause bring year trip candidate radio production sit get your final treatment.,Hi,27-08-2025 20:27,99,,3,No,19.068549,73.019364,0.92
C1433,D2,WiFiIssu,Grow note Republican computer quality miss education.,Hi,28-11-2025 10:45,47,Elect Dept,5,No,19.211843,73.018694,0.34
C1434,C2,WiFiIssu,Artist fly reality sense by run break know stop doctor risk billion.,Med,30-06-2025 11:58,86,Watr Dept,10,Yes,19.054803,73.054217,0.14
C1435,C1,Trafic,Brother sister cultural guess suddenly strong herself long report party whether tree fast.,Lo,03-02-2025 14:46,40,Elect Dept,1,No,19.120247,72.876052,0.4
C1436,A2,Pothl,Call inside build my example technology with.,Hi,28-08-2025 23:48,45,Road Dept,1,No,19.178754,72.843361,0.45
C1437,C2,Watr,Outside country bring investment environmental successful sense song together similar wear do study.,Lo,31-05-2025 18:12,23,Clean Dept,1,Yes,19.258485,72.998083,0.41
C1438,D2,Pollutn,Somebody nearly their anyone natural what blue question generation box each others.,Hi,29-11-2025 12:27,44,Road Dept,3,Yes,19.209641,72.929213,0.51
C1439,B2,Pollutn,Probably safe blue several grow color report tonight if chance administration later politics six city serious.,Med,30-05-2025 03:12,29,Clean Dept,5,No,19.072759,72.872672,0.86
C1440,B1,Pothl,First stage customer technology law step down whatever risk hope concern very.,Hi,24-04-2025 17:13,100,Road Dept,1,Yes,19.038638,72.994378,0.66
C1441,B1,Trafic,Meet teach question later customer significant this full nation southern.,Critcal,18-10-2025 10:59,6,Elect Dept,1,Yes,19.169692,72.91303,0.62
C1442,B1,Trafic,Two size chair employee collection reduce performance in.,,05-11-2025 06:41,117,Watr Dept,1,No,19.207858,73.011932,0.45
C1443,D2,Watr,Dream with respond the marriage memory then the only to.,Hi,07-09-2025 01:51,30,Elect Dept,3,Yes,19.02831,72.983303,0.33
C1444,B1,Pothl,Explain phone teach course course everyone matter in their relationship.,Critcal,11-03-2025 09:41,94,Road Dept,2,No,19.080379,73.027973,0.85
C1445,B2,Stret Light,Operation federal summer pass hope member two through way state middle hand.,Lo,19-02-2025 08:20,83,,1,No,19.252075,73.095963,0.18
C1446,C1,Pothl,Surface visit trip despite home evidence fear final country but.,Hi,21-02-2025 19:55,80,SmartWifiDept,1,Yes,19.155199,72.901885,0.51
C1447,D1,WiFiIssu,Program learn foreign rule carry wife house tree pay visit car option allow if.,Hi,24-10-2025 08:36,74,Clean Dept,3,Yes,19.143342,72.847085,0.04
C1448,D2,Pothl,Economic national game black politics factor without chance week should run improve simple current.,Hi,12-06-2025 23:50,42,Clean Dept,3,Yes,19.020287,72.88077,0.83
C1449,A1,Watr,Popular product necessary likely win sense his shake after rather available bit world question bank.,Med,15-10-2025 05:46,11,Watr Dept,3,No,19.096199,72.930974,0.21
C1450,A1,Watr,Fear glass conference help right moment check baby group practice Republican building.,Hi,25-05-2025 17:11,,Elect Dept,10,Yes,19.238512,72.809584,0.38
C1451,D1,Stret Light,Financial suffer after street thought town possible whose charge between represent.,Critcal,23-06-2025 03:09,33,Road Dept,,No,19.200988,72.824764,0.72
C1452,D2,Garbge,Law sound by poor fly city most sometimes threat good their recognize seat.,Hi,26-10-2025 08:06,80,Watr Dept,1,No,19.116003,72.941664,0.74
C1453,D1,Pothl,Economy result bank war fight floor low look time when may true sit cut there collection.,Med,01-07-2025 19:33,61,,2,No,19.289119,72.987681,0.85
C1454,B2,Trafic,Story book and show hope west them kid book other anything each.,Med,06-04-2025 08:00,99,Clean Dept,5,Yes,19.152532,72.90508,0.24
C1455,B2,Watr,Serious available wonder argue of type true little bit.,Med,04-10-2025 08:36,,Road Dept,5,Yes,19.231755,72.933367,0.2
C1456,A2,Trafic,Know mission way hit across exist thought again money song require lay.,Med,14-09-2025 23:23,1,Elect Dept,4,Yes,19.082093,72.987517,0.91
C1457,D1,Pothl,We national task air rich religious write sometimes add never authority.,Med,15-09-2025 14:28,88,Elect Dept,,Yes,19.151118,72.853891,0.49
C1458,C2,Garbge,Outside ten institution west play charge animal child discussion help reflect model.,,02-06-2025 06:20,2,Elect Dept,3,Yes,19.068605,73.04857,0.61
C1459,B1,Pothl,True which continue win expect along society campaign hospital song when position need attention board.,Critcal,15-11-2025 06:40,21,Clean Dept,3,No,19.280737,72.816088,0.2
C1460,B1,Stret Light,Adult debate someone piece case compare reach watch reality nor least while art.,,22-03-2025 06:39,,Elect Dept,5,No,19.283951,72.855115,0.81
C1461,A2,Pothl,Paper next subject professional newspaper case television resource single I night politics.,Med,17-02-2025 03:46,,SmartWifiDept,1,Yes,19.176568,73.048973,0.28
C1462,C2,WiFiIssu,Thank production move these blue hear sea physical.,Med,13-10-2025 11:35,,Elect Dept,1,No,19.214778,72.866368,0.67
C1463,C1,Garbge,Certain medical people rather test son maintain may worry should back prevent responsibility need cover.,Hi,10-09-2025 08:35,64,Elect Dept,3,Yes,19.210285,72.826097,0.61
C1464,D1,Pollutn,New fall enter group never main since win two today data check pass change drop tree.,Lo,16-07-2025 04:23,55,Elect Dept,3,Yes,19.060445,72.971486,0.91
C1465,A1,Garbge,Full simply federal fact good soldier old only little compare smile worker recently everybody standard PM.,Med,06-08-2025 08:44,55,,1,No,19.17745,72.831897,0.66
C1466,B2,WiFiIssu,Nor fight never drive fund for performance.,Critcal,28-03-2025 00:08,102,Watr Dept,5,No,19.032039,72.860825,0.2
C1467,C2,Garbge,Fill section provide themselves scene line and test beyond senior key visit.,Critcal,13-09-2025 13:45,56,Elect Dept,3,No,19.228063,72.94288,0.06
C1468,C2,Watr,News job lose his agent break word dog what.,Critcal,11-11-2025 18:51,53,Watr Dept,3,No,19.11314,72.818876,0.79
C1469,A1,Garbge,Determine hotel someone letter everyone everybody price reveal see money day raise pull total.,Lo,30-05-2025 19:00,68,Road Dept,3,No,19.22148,72.822519,0.58
C1470,B1,Trafic,Place enough cut force defense generation every country conference.,Lo,09-07-2025 03:38,,Road Dept,3,No,19.028643,72.865326,0.76
C1471,A1,Watr,Yet assume painting reach bring more loss same.,Lo,02-05-2025 14:07,114,Elect Dept,5,Yes,19.166351,72.953928,0.74
C1472,C2,Pothl,Indicate type sing arm my push security feel either among majority few notice trip agent.,Med,14-09-2025 00:48,85,Clean Dept,4,Yes,19.134153,73.001727,0.16
C1473,B1,Garbge,Point dinner field by affect continue enter record artist body organization into dinner coach.,Med,03-09-2025 15:45,20,Clean Dept,5,Yes,19.174494,72.960291,0.34
C1474,A2,Pothl,Else performance hear Republican most anyone prove simple own.,Critcal,25-11-2025 03:39,111,Watr Dept,3,No,19.156073,72.970597,0.47
C1475,D1,Watr,Task form despite think southern fact prove rich exactly prove fight agent her Mr fly address.,Lo,28-10-2025 15:23,107,,1,No,19.073513,73.083686,0.79
C1476,A2,Stret Light,Government million argue matter explain onto realize method chance leader.,Med,25-06-2025 13:00,76,Clean Dept,5,No,19.133407,72.973531,0.45
C1477,B2,Trafic,Personal mission guess former make perform figure common necessary.,Med,08-09-2025 21:48,40,Elect Dept,5,Yes,19.171335,72.996601,0.48
C1478,D2,WiFiIssu,Agree evening beat present business second mean per action cost opportunity walk prevent.,Lo,23-02-2025 14:04,39,Road Dept,,No,19.264387,72.933912,0.47
C1479,D2,Trafic,State indicate country image describe lawyer arrive tonight election top.,Hi,17-04-2025 06:53,105,Watr Dept,,Yes,19.066616,72.813397,0.86
C1480,B1,Trafic,Staff point several voice fish risk body.,Critcal,11-08-2025 05:14,87,Elect Dept,1,Yes,19.095435,72.988271,0.9
C1481,B2,Trafic,Player she fact in behavior usually everybody significant executive understand claim.,Critcal,10-09-2025 00:52,,Elect Dept,5,Yes,19.112216,72.903129,0.05
C1482,A1,Pollutn,Course what soldier five save anyone red argue tonight usually ago opportunity.,Hi,13-01-2025 21:26,6,Elect Dept,1,Yes,19.29958,73.065359,0.32
C1483,C2,Pollutn,Parent receive good drug popular opportunity forget my check grow move itself.,Med,08-11-2025 22:20,43,Watr Dept,4,Yes,19.160583,72.810498,0.88
