Citizen_ID,Area_Sector,Issue_Type,Complaint_Text,Severity_Level,Reported_Time,Resolution_Time_Hours,Assigned_Department,Satisfaction_Rating,Followup_Required,Latitude,Longitude,AI_Priority_Score
C1484,C1,Garbge,Nothing Republican account style purpose entire find discussion no form usually I community mouth above you.,Hi,02-01-2025 05:00,3,Watr Dept,5,Yes,19.248701,73.067804,0.16
C1485,D2,Stret Light,Different realize thought general meet scientist out blood.,Lo,07-04-2025 02:45,,Road Dept,5,Yes,19.005146,72.94983,0.99
C1486,D1,Stret Light,Business pass care girl population central rest nice final computer woman body clearly meeting voice.,Lo,13-09-2025 10:55,109,Clean Dept,2,Yes,19.271606,72.992322,0.44
C1487,C1,Pollutn,Such huge throw drive week last move treat there but hold development team.,Med,10-03-2025 22:41,83,Watr Dept,4,No,19.118336,73.017421,0.82
C1488,C2,Trafic,Guy actually despite skin draw inside his.,Hi,26-04-2025 22:36,74,Watr Dept,4,Yes,19.110162,73.07262,0.7
C1489,C2,Pothl,Degree suggest agree laugh girl score threat together.,Critcal,17-02-2025 12:05,115,Elect Dept,4,No,19.128707,73.053441,0.24
C1490,A2,Garbge,Tax Mr truth majority huge field property bring culture expert maybe girl sea series.,Lo,01-09-2025 12:06,,Elect Dept,4,Yes,19.139266,73.077399,0.55
C1491,C2,Pothl,Wait identify describe rule bit movie share term care rate team.,Lo,04-08-2025 08:21,60,Watr Dept,2,No,19.086061,73.041343,0.65
C1492,D2,Stret Light,Compare manager account her impact already different along how often worry think because federal need.,Hi,10-05-2025 11:32,50,SmartWifiDept,10,Yes,19.115122,73.05247,0.09
C1493,D1,Trafic,Black father rest sense adult happy mother million list air bar.,Critcal,06-12-2025 11:56,,Road Dept,,Yes,19.02909,72.950724,0.2
C1494,A1,Garbge,Also thing law chance successful visit away determine.,Critcal,16-01-2025 11:17,28,SmartWifiDept,5,No,19.043765,72.878055,0.17
C1495,C2,Trafic,Radio we race explain eight large clear change home whatever force man.,,05-09-2025 02:17,46,,5,No,19.103795,72.92917,0.94
C1496,B2,Stret Light,Food involve again against up choice Democrat in.,Critcal,01-09-2025 19:36,20,,4,No,19.106412,73.032405,0.65
C1497,C2,Trafic,Opportunity me low price action TV point student art above west officer despite interest.,Lo,10-06-2025 13:04,87,Road Dept,1,No,19.106683,72.879267,0.69
C1498,C2,Stret Light,Minute newspaper operation option Congress someone soldier value rather few firm.,,24-04-2025 21:46,111,Watr Dept,5,No,19.192684,72.831254,0.54
C1499,A1,Trafic,Yeah budget myself firm allow process save treat story some more.,Med,15-05-2025 00:51,97,Road Dept,3,No,19.149071,73.017132,0.44
C1500,A1,WiFiIssu,Chair information Congress ok wait let these.,Critcal,03-01-2025 07:19,117,Watr Dept,3,No,19.060626,72.962317,0.33
C1501,A1,Pothl,Step owner school after gun even administration ball unit professor government.,Med,19-06-2025 09:07,102,Clean Dept,3,Yes,19.284678,73.024376,0.98
C1502,B2,Pothl,Business physical camera break yes stay prepare central season daughter though order.,Med,13-01-2025 18:43,23,Watr Dept,,Yes,19.258759,72.878427,0.2
C1503,A1,Stret Light,Reduce forget reveal own my body read scientist during we truth than population team training.,Critcal,17-02-2025 00:48,72,Elect Dept,1,Yes,19.165708,73.084163,0.61
C1504,B1,Pothl,Sometimes ability cultural person treatment and kitchen theory deal tonight generation late simply.,Critcal,04-11-2025 05:30,44,SmartWifiDept,10,No,19.008701,73.078048,0.58
C1505,D1,WiFiIssu,Staff send beyond factor base information tend center film.,Hi,06-05-2025 10:44,70,SmartWifiDept,3,Yes,19.150913,73.026814,0.98
C1506,C2,Stret Light,Meeting voice run face loss purpose probably child beat human common evening.,Med,23-09-2025 05:56,44,Watr Dept,,No,19.113687,72.966615,0.36
C1507,B2,Stret Light,Opportunity other happy situation chance reach spring.,Hi,02-05-2025 12:09,,Watr Dept,4,No,19.0505,73.086533,0.43
C1508,C2,Trafic,Although evening figure left speak state this computer book player sometimes parent room brother very.,Hi,27-07-2025 15:56,,Road Dept,5,Yes,19.220678,72.990163,0.41
C1509,A1,Garbge,Writer believe fish meet order year agree yard majority east.,,12-10-2025 01:45,114,Elect Dept,,No,19.299635,72.828483,0.93
C1510,A1,WiFiIssu,Language never move see meet reveal decision improve live real throughout.,Hi,28-07-2025 09:36,,,2,Yes,19.022486,73.056969,0.14
C1511,C2,Stret Light,Shake often still economy face visit analysis fact truth behind baby similar.,,29-11-2025 21:14,102,SmartWifiDept,1,No,19.017132,72.993635,0.13
C1512,D2,WiFiIssu,The front might white control whose wrong hand much commercial least animal term.,Lo,28-09-2025 21:04,115,,1,Yes,19.153428,73.08369,0.41
C1513,D2,Garbge,That blood within stop reduce member politics.,Lo,18-03-2025 20:59,80,Watr Dept,1,No,19.10573,72.823473,0.95
C1514,A2,Trafic,During step treat face candidate me surface occur half production rather few.,Critcal,30-05-2025 07:40,33,SmartWifiDept,2,Yes,19.091609,73.085222,0.53
C1515,B2,Stret Light,Place already only kid past thank Democrat world again involve detail talk.,Hi,16-02-2025 02:28,32,SmartWifiDept,10,Yes,19.234317,73.0304,0.01
C1516,B2,Stret Light,Still teacher response she there together cup we safe recent make something animal land.,Critcal,23-01-2025 02:02,,,4,No,19.154036,73.09661,0.2
C1517,C1,Stret Light,Window trouble network beautiful second place after detail often idea industry relate authority no magazine.,Hi,24-08-2025 19:08,59,,4,No,19.22935,72.83049,0.19
C1518,B1,Stret Light,Change cup modern tough series stage more pull bad visit later decision product lawyer.,Hi,15-11-2025 19:31,86,SmartWifiDept,2,No,19.055605,72.965435,0.76
C1519,C2,Garbge,Win measure people occur need reality opportunity however address successful these.,Hi,04-10-2025 03:16,67,Elect Dept,,No,19.057147,73.076312,0.17
C1520,A2,Pothl,Along door in realize sit network nor nature second among party remain game reason like.,Med,15-06-2025 11:25,118,Watr Dept,2,Yes,19.232828,73.053336,0.22
C1521,A2,Garbge,Population training upon benefit real water record use get medical sport ability order whose test place.,,11-05-2025 18:24,90,Watr Dept,1,No,19.216331,72.883139,0.26
C1522,A2,Pothl,Attorney central degree himself all let almost image bag.,,09-03-2025 15:05,26,SmartWifiDept,5,Yes,19.084077,72.842857,0.86
C1523,A1,Watr,Throughout heart place maintain bad happy do record.,Critcal,31-01-2025 03:20,115,Clean Dept,2,Yes,19.254152,73.083442,0.8
C1524,A1,Trafic,Spring tell serious rate simple debate home simple quite.,Lo,23-03-2025 10:06,49,,4,No,19.188164,72.83251,0.02
C1525,B1,WiFiIssu,Town marriage wife past short never heart.,Med,06-11-2025 09:14,73,Road Dept,4,No,19.040667,72.821438,0.14
C1526,B2,Pollutn,Think nature career memory physical edge long direction bad check heavy recognize whether.,Hi,01-02-2025 07:32,113,SmartWifiDept,10,Yes,19.198997,72.877737,0.74
C1527,D2,Pothl,Available forward argue economic more writer article.,Med,23-09-2025 11:05,98,Road Dept,1,Yes,19.131027,72.997054,0.47
C1528,A1,Stret Light,Technology close full group as effect direction quality thank short million these two task vote nice.,Hi,25-06-2025 02:12,18,Clean Dept,3,Yes,19.222984,72.909257,0.57
C1529,A2,Pollutn,Five song case week nice quite spring this entire by page all.,Lo,15-05-2025 09:39,116,SmartWifiDept,1,Yes,19.070637,73.037822,0.27
C1530,D1,WiFiIssu,Gun successful determine federal have card paper.,Hi,03-06-2025 10:24,48,Elect Dept,4,Yes,19.006361,72.942167,0.23
C1531,C1,Garbge,Finally back sometimes drug maintain we line cause would probably usually.,Hi,05-01-2025 13:13,60,Road Dept,4,Yes,19.15401,73.083354,0.75
C1532,B1,WiFiIssu,Pattern cold realize approach during fear less no southern thought majority whose relationship wonder newspaper million.,Critcal,17-06-2025 16:03,2,Elect Dept,4,Yes,19.175399,72.900161,0.47
C1533,D1,Stret Light,Among several long pressure garden side so security would country one contain the until allow.,Hi,13-05-2025 08:22,,Clean Dept,1,Yes,19.214461,73.062317,0.51
C1534,A2,Pollutn,Light school many guess understand course wonder rate standard single purpose.,,25-09-2025 13:45,109,Watr Dept,4,Yes,19.288034,73.07689,0.04
C1535,B1,Watr,Plant me opportunity west small information around hard father girl evening environment.,Hi,12-10-2025 05:02,88,Road Dept,5,No,19.007553,73.033473,0.72
C1536,A2,Pothl,Us health authority individual treat player build raise manager give.,Hi,20-06-2025 06:08,,Watr Dept,4,No,19.290063,73.059043,0.88
C1537,D1,Pothl,Vote above although like young sea hundred.,Lo,08-05-2025 21:50,46,Elect Dept,5,No,19.168243,72.958935,0.65
C1538,B2,Watr,Poor some certainly two attention time while simple.,Med,21-10-2025 05:36,51,Elect Dept,4,Yes,19.084857,73.004562,0.57
C1539,B2,Watr,Store coach site more pretty worry face stand organization right civil vote blood contain why voice.,,23-05-2025 17:43,,Elect Dept,3,Yes,19.140961,72.855839,0.03
C1540,D2,Pollutn,Director interview then fire quite song drive.,Critcal,18-04-2025 20:50,,Road Dept,,Yes,19.061232,73.026452,0.47
C1541,B2,Stret Light,Interesting town commercial fear garden east can name job interesting if example process include he.,Hi,07-05-2025 08:20,,Watr Dept,1,No,19.150674,72.861669,0.46
C1542,B2,Watr,Say cut begin lot exist international chair machine stock material wear fall skill my significant cell.,Med,14-10-2025 16:37,72,Road Dept,5,Yes,19.218537,72.968184,0.74
C1543,C2,Pollutn,Fast hair that feeling bill wall camera price total almost bill mind.,Critcal,24-11-2025 01:29,,,2,No,19.149891,73.049367,0.58
C1544,C1,Trafic,Improve business position conference business since risk green begin appear both heart financial hand.,Hi,18-05-2025 08:46,101,Elect Dept,4,Yes,19.173783,72.861879,0.13
C1545,B1,Watr,Specific evidence bank media girl peace whole else feeling play practice street.,Hi,20-03-2025 21:15,31,SmartWifiDept,4,Yes,19.202977,72.979553,0.28
C1546,A2,WiFiIssu,Office effect address number yet service voice direction say when still science visit ground.,Med,05-08-2025 11:35,46,Elect Dept,3,No,19.126521,73.003118,0.48
C1547,A1,Pollutn,Think issue week last four cover shake customer it statement skin memory.,Critcal,24-11-2025 10:45,72,SmartWifiDept,4,No,19.109964,72.953785,0.22
C1548,D1,Garbge,Leg better court smile group statement carry structure to.,Hi,14-11-2025 13:19,85,Elect Dept,4,No,19.019296,72.972457,0.53
C1549,A2,Watr,Officer pick should heart possible Congress board their race become agent garden water safe.,Lo,12-09-2025 21:06,114,SmartWifiDept,1,No,19.041831,72.911136,0.01
C1550,B2,Trafic,Yard especially PM senior miss now drive well state answer night magazine.,Critcal,08-02-2025 10:42,83,SmartWifiDept,5,Yes,19.090917,72.97124,0.64
C1551,D1,Trafic,Crime sister become article bad age throughout letter can.,Hi,04-08-2025 02:43,69,Clean Dept,,No,19.145127,72.975766,0.24
C1552,A1,Pothl,Condition most two exist bit apply want seek official hard write pay.,Critcal,22-10-2025 15:02,18,Watr Dept,3,Yes,19.176463,72.824165,0.68
C1553,D2,Pollutn,Really environment almost interesting yourself military usually.,Lo,05-02-2025 08:32,10,Road Dept,,No,19.238027,72.819359,0.16
C1554,A1,Trafic,Allow position fight heavy analysis tree prevent stuff.,Med,28-03-2025 01:22,34,Watr Dept,,No,19.243909,72.891469,0.32
C1555,B2,Pothl,Case part which me official range so.,Lo,02-11-2025 01:24,91,Road Dept,5,Yes,19.220114,72.976414,0.75
C1556,A2,WiFiIssu,Once hard turn scene executive successful happy certainly low over these draw course field.,Critcal,25-02-2025 05:32,49,Watr Dept,,No,19.081652,72.973318,0.98
C1557,B1,Stret Light,Dinner executive for list because station activity.,Hi,11-03-2025 12:09,16,Clean Dept,4,Yes,19.009783,73.085019,0.15
C1558,B1,Trafic,Least film their for here yourself trouble himself.,Med,04-05-2025 10:05,89,Clean Dept,3,No,19.221772,72.962962,0.8
C1559,D2,Stret Light,Pressure rate law recent move toward become back have in standard country bag top.,Lo,29-09-2025 02:48,117,Clean Dept,,No,19.17592,72.86154,0.43
C1560,B1,Pollutn,Scientist too candidate town direction out house by marriage.,Lo,09-08-2025 00:12,71,Elect Dept,3,Yes,19.25516,72.947898,0.69
C1561,A1,Garbge,Smile south throw store training nature behavior low painting role establish take.,Hi,15-05-2025 01:06,102,Elect Dept,4,No,19.15108,73.004568,0.19
C1562,A1,Pothl,Such player resource among three special plant between them must born page development as treat.,Critcal,13-06-2025 18:23,31,Road Dept,2,No,19.133918,72.981867,0.38
C1563,A1,Garbge,Young century return out middle yeah design mission national class participant color management production nothing.,Hi,03-02-2025 21:52,,SmartWifiDept,2,No,19.002916,73.066304,0.38
C1564,D2,Watr,Whole free draw laugh inside star forget including fill wait then wonder.,Med,25-06-2025 06:17,50,SmartWifiDept,3,Yes,19.279048,73.062701,0.94
C1565,C2,Pollutn,Surface soon quality security ability inside fall customer energy environment same rule your drop.,Critcal,28-10-2025 07:16,91,Watr Dept,3,No,19.195602,72.956299,0.14
C1566,D2,Stret Light,Truth stand school kid involve reduce time site.,Lo,29-06-2025 03:57,40,SmartWifiDept,3,No,19.244898,72.858371,0.37
C1567,B2,WiFiIssu,Animal explain dog great movement total help director page physical.,Critcal,08-12-2025 12:19,19,Watr Dept,1,No,19.24476,73.038439,0.72
C1568,D1,Stret Light,Later animal eat garden husband identify respond read change home ever he paper information.,Critcal,31-10-2025 15:57,33,Clean Dept,5,No,19.086028,73.081517,0.28
C1569,A1,Watr,Leave carry fact evidence who consider friend job grow person goal study amount head.,Critcal,04-06-2025 02:15,98,Elect Dept,3,No,19.066726,72.903601,0
C1570,A1,Pollutn,Consider little certainly do head worry magazine team free story white score road management I else.,Lo,04-03-2025 17:02,110,Watr Dept,1,Yes,19.109414,72.888901,0.12
C1571,A1,Pollutn,Medical start apply site participant road reality worker what share allow make single structure.,Med,18-05-2025 02:10,52,,2,No,19.218118,72.988295,0.19
C1572,D2,Watr,Well ever type environmental reach soldier success hair shake wind this up development space red.,Critcal,20-11-2025 16:08,71,Watr Dept,5,Yes,19.202943,72.883644,0.89
C1573,D2,Trafic,West morning avoid throughout how manager share source focus news story new body scientist.,Hi,23-07-2025 19:46,88,Watr Dept,1,Yes,19.055845,72.831258,0.69
C1574,A1,WiFiIssu,Onto challenge federal fear debate total democratic.,,06-12-2025 15:31,,Elect Dept,2,No,19.131479,72.801426,0.26
C1575,A1,Watr,Voice today report protect identify necessary owner charge family box understand everybody far.,,03-11-2025 02:28,,Road Dept,4,Yes,19.241091,73.06935,0.02
C1576,A2,Pothl,Toward offer either late model parent draw whose site.,Critcal,13-10-2025 13:36,71,,,Yes,19.223959,72.985266,0.82
C1577,D1,Garbge,Majority space real safe dinner beyond buy including thousand across executive small.,Hi,27-04-2025 11:39,67,Clean Dept,1,Yes,19.100018,72.911243,0.35
C1578,D2,Pollutn,Speech television become shake good onto off break majority tough lay remember raise kitchen speak.,Med,04-11-2025 21:15,99,Road Dept,4,No,19.279754,72.992315,0.61
C1579,C1,WiFiIssu,Understand fish catch find standard partner affect reach free organization reach raise line unit.,Med,27-01-2025 19:35,49,Watr Dept,1,No,19.135592,72.824377,0.92
C1580,D1,Garbge,Control eye determine pretty finish positive hour state.,Hi,04-09-2025 23:41,52,SmartWifiDept,2,No,19.028572,72.877458,0.8
C1581,A1,Trafic,Event side treatment eye feel manager item.,Critcal,08-11-2025 04:12,113,Watr Dept,1,Yes,19.123633,73.017475,0.08
C1582,A1,WiFiIssu,Change success bring sense sit artist you recognize figure bar woman owner morning that movement bar.,Critcal,17-03-2025 04:06,104,Elect Dept,2,Yes,19.127917,72.839145,0.03
C1583,B2,Pollutn,Some under view easy team trial specific information big.,Lo,18-09-2025 00:01,109,Road Dept,2,No,19.250014,72.824057,0.26
C1584,A2,WiFiIssu,Compare tough administration door single medical national phone.,Critcal,07-01-2025 18:09,,SmartWifiDept,5,Yes,19.101667,73.068311,0.77
C1585,A1,Watr,Recently member technology wife we strong prepare may six market skin.,Med,09-09-2025 17:49,89,Elect Dept,1,Yes,19.094779,73.040161,0.34
C1586,B1,WiFiIssu,So exist herself serve at environment inside.,Critcal,15-01-2025 07:01,112,Watr Dept,3,Yes,19.063755,72.846648,0.92
C1587,A1,Trafic,Ground key fish green operation source enjoy many boy situation.,Med,24-01-2025 06:15,113,SmartWifiDept,1,Yes,19.059515,72.936232,0.75
C1588,D2,Stret Light,Thus necessary behind president line individual eight.,Hi,01-04-2025 02:19,114,SmartWifiDept,1,No,19.091213,73.009705,0.25
C1589,C2,Stret Light,Upon technology half experience interview wind low sound window.,Lo,04-03-2025 06:45,,SmartWifiDept,2,Yes,19.14345,72.805692,0.22
C1590,A1,Pothl,Deal science important participant allow attention matter thing individual issue summer.,Critcal,08-05-2025 18:28,35,Clean Dept,1,Yes,19.294066,72.841759,0.06
C1591,A1,Stret Light,World election go player skin experience hundred race husband him movie.,Lo,24-01-2025 01:16,29,Watr Dept,1,No,19.246982,72.801719,0.86
C1592,A2,Pothl,Professor rather suddenly voice be red economic expect night tend size.,Med,09-10-2025 05:45,51,Elect Dept,5,No,19.288254,72.861046,0.26
C1593,D1,WiFiIssu,Draw assume claim them send other art that writer entire how.,Med,30-10-2025 06:48,54,Elect Dept,2,No,19.023454,72.973584,0.64
C1594,C2,WiFiIssu,Center east cause rise over stop voice speech explain its appear opportunity run plant ball notice.,Med,01-02-2025 12:27,74,,2,No,19.052926,72.986246,0.45
C1595,C1,Stret Light,Effort standard wish third have away drug work around so agency main whose else she assume.,Hi,24-11-2025 17:59,86,,5,Yes,19.297388,72.901563,0.28
C1596,B2,Watr,Term statement son away ten check list again something reveal especially herself agent.,Lo,11-10-2025 21:23,,Elect Dept,1,Yes,19.260896,73.033666,0.2
C1597,B1,Pothl,White relationship game southern discuss whom choose pay stay education none over up.,Hi,18-10-2025 06:42,38,Elect Dept,,Yes,19.124406,72.83507,0.08
C1598,C1,WiFiIssu,Kind outside modern other then city top Republican talk there safe.,Hi,15-08-2025 17:36,113,Clean Dept,2,No,19.234953,72.88659,0.16
C1599,A2,Pollutn,Now want up response nothing heavy goal series business.,Med,25-06-2025 17:59,63,SmartWifiDept,5,No,19.008071,73.086443,0.12
C1600,D2,Garbge,Either white physical charge coach such individual law data question citizen plant language north assume.,Hi,16-08-2025 16:45,78,Elect Dept,4,Yes,19.191347,73.06942,0.3
C1601,D1,Pollutn,Present threat simply see enough artist challenge according collection or ball eat interview big.,Hi,26-10-2025 20:39,36,SmartWifiDept,2,Yes,19.005267,73.058636,0.48
C1602,B2,Watr,Cover reveal and amount property lawyer star visit any serious happen tonight forget.,Critcal,26-11-2025 23:33,,SmartWifiDept,3,No,19.281578,73.03159,0.52
C1603,A2,Stret Light,Middle leg matter treatment international sign way.,Lo,07-08-2025 07:14,43,Watr Dept,4,Yes,19.207978,73.064757,0.21
C1604,D1,Pothl,Suddenly money carry probably move build news assume yourself bit ball human her prove.,Critcal,18-10-2025 10:24,111,,4,Yes,19.03399,72.898923,0.39
C1605,C1,Stret Light,Deal low cut simple cold government magazine economy stuff.,,24-11-2025 08:00,34,Elect Dept,,No,19.003463,72.880497,0.09
C1606,D1,Pothl,Country really wonder exist husband source care government.,Critcal,25-11-2025 19:37,118,Clean Dept,5,Yes,19.262437,72.937733,0.69
C1607,B1,Stret Light,After lay three already husband result contain pass push computer cost series loss.,Hi,07-01-2025 00:21,38,Clean Dept,4,No,19.200081,72.848958,1
C1608,B1,Garbge,Yes ago stand dream mind response program require suddenly account politics though character cell marriage their.,Med,18-02-2025 03:10,67,SmartWifiDept,4,Yes,19.136577,72.908594,0.95
C1609,D1,Pollutn,Huge shoulder similar place crime none court power position force fish organization stuff pass.,Med,03-06-2025 20:29,,Clean Dept,3,Yes,19.247595,72.829346,0.72
C1610,B1,Pollutn,Team particularly ability specific have stuff compare industry world.,Lo,27-05-2025 02:43,120,Road Dept,4,Yes,19.247934,72.945439,0.9
C1611,D2,Watr,Environment after decision total song need answer movie south goal team paper area range up but.,Med,10-05-2025 19:47,32,Road Dept,2,No,19.196218,72.818152,0.52
C1612,B2,Pollutn,Song course detail suffer every evening would indeed affect same say act indeed authority hard.,Med,31-05-2025 04:21,111,,2,Yes,19.285795,73.089207,0.73
C1613,C1,Garbge,No throw no accept imagine film section way head.,Critcal,16-08-2025 21:03,3,Clean Dept,1,No,19.106295,72.940125,1
C1614,C1,Trafic,Team international face edge fill nearly say shoulder truth represent could pull sea small score.,Critcal,02-08-2025 08:23,117,Road Dept,2,Yes,19.089414,72.801456,0.55
C1615,C1,Garbge,Thank name including others sell increase buy little various star show conference exist.,Hi,22-03-2025 16:23,22,Road Dept,5,No,19.087951,73.055307,0.84
C1616,D1,WiFiIssu,My establish president dream out later your people accept pass over under beyond.,Lo,06-10-2025 11:30,64,Clean Dept,5,Yes,19.030814,72.948566,0.64
C1617,B2,Watr,Activity accept trial inside prevent seem total foreign institution clearly those despite.,Med,13-02-2025 03:55,25,Watr Dept,3,No,19.291939,73.018851,0.66
C1618,D2,Stret Light,Speech fish name stop national attention away camera focus suggest also language beyond many.,Hi,07-04-2025 21:03,38,Elect Dept,2,Yes,19.078477,72.836041,0.82
C1619,A1,Garbge,Entire strong head agree quite north between.,Med,10-05-2025 07:18,106,,5,No,19.25952,73.047887,0.79
C1620,A1,Trafic,Beat agree choose option official attention sure campaign partner.,Med,09-04-2025 11:47,101,Elect Dept,5,Yes,19.203286,73.02367,0.31
C1621,D1,Watr,Water a would door here agreement admit data receive how.,Hi,12-07-2025 11:42,999,Watr Dept,5,Yes,19.172262,72.918268,0.82
C1622,D1,Stret Light,She answer white color senior treatment how six war safe.,Critcal,04-08-2025 12:10,100,Watr Dept,3,Yes,19.206059,72.887093,0.17
C1623,B1,Pollutn,Whose rich her fund realize party every car pattern coach money.,Critcal,13-09-2025 22:22,91,Road Dept,4,No,19.009669,72.977743,0.29
C1624,C1,Stret Light,Position student reality nation any pressure focus table without say rest prove.,Hi,09-06-2025 03:00,,Clean Dept,3,No,19.100825,73.07968,0.41
C1625,B1,Stret Light,Send church woman must despite look job reduce nice left away yet environment about law.,,30-10-2025 04:26,9,SmartWifiDept,5,Yes,19.247211,73.044866,0.58
C1626,C1,Stret Light,Point democratic side type yourself although drop current attorney property across score rate physical happen.,Med,29-01-2025 13:35,13,,4,Yes,19.244024,72.909338,0.89
C1627,D1,Pothl,Public will challenge choice how and often office chair its happen long daughter various example.,Med,29-04-2025 19:24,47,Road Dept,4,No,19.291949,73.091298,0.51
C1628,D1,WiFiIssu,Place likely almost feeling discover indicate article soldier wall order perhaps record head war.,Med,06-10-2025 17:57,50,Road Dept,1,Yes,19.037959,72.911349,0.14
C1629,B1,Stret Light,Teach exist physical difference discussion make every future he people interesting network.,Lo,26-01-2025 04:05,38,,5,Yes,19.233953,72.843343,0.38
C1630,D1,Pothl,Last on assume good student trouble I together past argue visit election class.,Critcal,19-01-2025 00:13,78,Watr Dept,,No,19.185158,73.048949,0.28
C1631,B2,Trafic,Executive strategy too easy tree moment seat tax learn control easy ever.,Lo,25-03-2025 12:00,91,Watr Dept,4,Yes,19.254789,72.969379,0.97
C1632,C2,Trafic,Especially senior recent accept will how difficult material space opportunity series computer any baby.,,16-07-2025 17:08,,Watr Dept,5,Yes,19.274763,72.845356,0.64
C1633,C1,Pothl,Role us college specific contain court street finish season summer to tree.,,22-04-2025 10:08,82,Elect Dept,5,No,19.243446,72.867331,0.03
C1634,B1,WiFiIssu,Able security land a stand movie leave.,Lo,11-10-2025 08:48,114,Road Dept,10,Yes,19.201571,72.950492,0.71
C1635,D1,WiFiIssu,Fight boy risk page well safe note follow ability accept however family.,Med,06-01-2025 21:14,59,SmartWifiDept,1,No,19.153272,72.978627,0.91
C1636,B1,Pollutn,Any offer administration increase hold study community fear serious north first idea recent allow adult.,Lo,06-05-2025 14:08,,Elect Dept,,Yes,19.079083,73.010761,0.93
C1637,C2,WiFiIssu,Activity culture coach politics keep onto like book trouble nice fund.,,28-07-2025 12:06,7,,3,No,19.022815,72.892633,0.84
C1638,D2,WiFiIssu,Manage son hard film as particular among bad seat structure third later spring yes.,Hi,26-04-2025 16:29,87,Watr Dept,3,No,19.068684,72.843106,0.65
C1639,D1,Stret Light,Special scientist special into left weight government indicate result suddenly but.,Hi,16-11-2025 03:22,93,Elect Dept,2,Yes,19.007195,72.980507,0.72
C1640,C2,Pollutn,Might church sit structure phone director me.,Med,16-01-2025 15:27,39,Watr Dept,1,No,19.283799,72.917199,0.69
C1641,A1,Garbge,Person perhaps put pick wife make bit receive billion foreign beyond family hair.,Hi,26-06-2025 20:00,95,Watr Dept,2,No,19.163568,73.021388,0.26
C1642,C1,Watr,Themselves beyond pass gun song senior model material ago appear off.,Critcal,31-10-2025 19:50,55,Road Dept,1,No,19.130472,73.062994,0.74
C1643,C1,Pollutn,Amount official official break with mission for claim education term future effort.,Lo,17-08-2025 01:25,,Elect Dept,5,No,19.105285,72.942023,0.56
C1644,A2,Garbge,Collection walk manage join score sit everyone will line beyond military.,Med,14-08-2025 15:51,118,Watr Dept,4,Yes,19.192481,72.992639,0.21
