Citizen_ID,Area_Sector,Issue_Type,Complaint_Text,Severity_Level,Reported_Time,Resolution_Time_Hours,Assigned_Department,Satisfaction_Rating,Followup_Required,Latitude,Longitude,AI_Priority_Score
C1645,A2,WiFiIssu,During see reveal tough you hotel past hour full.,Critcal,23-09-2025 14:11,38,Clean Dept,3,No,19.080597,73.039825,0.24
C1646,A2,WiFiIssu,Stand vote last response his adult finally base concern about.,,31-08-2025 03:10,12,SmartWifiDept,5,No,19.173807,72.961461,0.99
C1647,B2,Stret Light,Fine media letter official serve explain information parent act run Mrs author structure those.,Hi,14-07-2025 15:04,85,Road Dept,3,No,19.060581,72.935036,0.59
C1648,C2,Garbge,Perform page produce activity add production smile citizen I center commercial yourself thought detail article least.,Lo,26-10-2025 05:20,38,Road Dept,1,No,19.176059,72.930136,0.74
C1649,D1,WiFiIssu,Particularly citizen project chance quickly player loss finish continue remain both age design room book government.,Hi,07-10-2025 17:08,79,Clean Dept,1,Yes,19.099312,72.986093,0.28
C1650,B2,Garbge,Degree rise grow investment face father run.,Med,04-07-2025 10:08,,Clean Dept,5,Yes,19.198101,72.977519,0.4
C1651,D1,Trafic,Activity authority seem machine development art consumer dream attorney anyone court heart sport.,Critcal,03-06-2025 22:27,101,Elect Dept,4,Yes,19.217587,72.938444,0.45
C1652,D1,Garbge,Hold cell apply bill foot real end own feel debate machine course I imagine of agree.,Lo,19-05-2025 22:30,52,Road Dept,5,Yes,19.174128,72.901002,0.51
C1653,A1,Trafic,Voice approach teacher lay she modern oil sometimes ability country.,Lo,21-11-2025 17:56,70,Clean Dept,3,No,19.275234,73.023806,0.42
C1654,C2,Pothl,Tough similar full wide billion right crime reflect authority happen great.,Critcal,04-05-2025 12:00,101,,5,Yes,19.121729,73.065722,0.57
C1655,C2,WiFiIssu,Require attention along wind result however training ground surface quality rule.,Lo,04-06-2025 20:50,120,Clean Dept,3,No,19.071525,73.061573,0.04
C1656,A2,Trafic,Rate amount arrive ability successful start certainly standard their affect there house up none throw believe.,Hi,23-03-2025 05:50,,SmartWifiDept,3,Yes,19.202373,73.005289,0.21
C1657,A1,Stret Light,Whom born between woman involve tonight somebody have doctor foreign admit worry discuss.,Critcal,06-03-2025 11:04,7,Watr Dept,4,No,19.165026,73.033329,0.49
C1658,B2,Trafic,Campaign just say establish left meet economy end act face child situation.,Hi,05-06-2025 20:59,11,Watr Dept,1,No,19.175063,73.090066,0.18
C1659,C1,WiFiIssu,Push shoulder dog interesting mouth down either year commercial piece type occur tree goal.,Critcal,01-06-2025 02:23,69,Watr Dept,4,Yes,19.221132,72.92523,0.75
C1660,A2,Trafic,Which might common shoulder hotel toward through painting within soldier.,Med,04-08-2025 22:15,,Watr Dept,4,Yes,19.207907,73.013688,0.87
C1661,D1,Pollutn,Suggest impact natural letter these skin hundred.,Critcal,20-11-2025 10:40,12,Road Dept,3,No,19.054651,72.843505,0.63
C1662,B2,Pothl,School knowledge direction nothing star TV identify.,Med,10-02-2025 13:06,81,Road Dept,5,No,19.143278,73.057572,0.15
C1663,D1,Trafic,Edge design three wish perhaps never always less age pass experience baby return hope.,Hi,27-05-2025 04:10,,Clean Dept,3,No,19.087331,72.927719,0.02
C1664,B1,Watr,Trial child pass thing open nature night make unit after bank him month responsibility garden report.,Lo,04-12-2025 15:29,52,Elect Dept,3,No,19.193364,72.850669,0.29
C1665,D2,Pollutn,Those group risk important technology brother rate little conference popular among large.,Critcal,09-04-2025 23:20,82,Watr Dept,2,Yes,19.051885,72.820086,0.39
C1666,B1,Garbge,Two candidate until order hit act camera image choice southern boy oil mouth size soldier no.,Med,17-06-2025 05:51,118,,,Yes,19.289904,72.83373,0.72
C1667,A1,Stret Light,Chance sell day music quality bank attack while sort.,Hi,03-05-2025 08:23,46,SmartWifiDept,1,Yes,19.051574,72.912394,0.33
C1668,C1,Watr,Form too buy serve from me include reason during work accept admit growth.,Lo,23-07-2025 02:57,56,Elect Dept,3,No,19.197434,73.00345,0.32
C1669,D1,Pothl,Answer mouth may identify form section resource serve officer some visit wonder.,,01-09-2025 02:37,93,Watr Dept,2,Yes,19.130772,72.862153,0.95
C1670,B1,WiFiIssu,Value these necessary vote yard reveal example Democrat receive affect.,Med,20-07-2025 21:00,2,,2,Yes,19.162088,73.079742,0.52
C1671,C1,Stret Light,Senior explain source hear candidate goal power.,,14-10-2025 07:55,96,SmartWifiDept,1,Yes,19.260101,73.017892,0.78
C1672,B2,Pothl,Drug up simply institution reveal concern have.,Hi,01-04-2025 12:00,36,Watr Dept,4,Yes,19.016598,72.892816,0
C1673,B1,Watr,Hot wonder so property young feel because anything this subject where idea start federal accept.,Critcal,19-01-2025 06:36,24,Clean Dept,2,No,19.214572,73.004121,0.17
C1674,B1,Stret Light,Environmental success figure section way magazine religious success quickly and under job.,Med,17-04-2025 03:38,,,4,No,19.138173,73.005714,0.37
C1675,C2,Garbge,Recent television success our green majority like.,Critcal,20-08-2025 22:06,101,Elect Dept,2,Yes,19.121883,72.806282,0.7
C1676,A2,Garbge,Authority stock police truth teach step sound Republican agreement.,Critcal,08-12-2025 21:31,13,SmartWifiDept,4,Yes,19.138869,73.07282,0.65
C1677,B2,Pollutn,Yet history star available allow weight agree kid no lay.,Lo,07-04-2025 12:25,27,Elect Dept,4,No,19.173802,73.001911,0.54
C1678,B1,Pothl,Book behind similar certainly window pick major animal.,Critcal,22-05-2025 10:51,51,Road Dept,5,No,19.293064,72.937294,0.45
C1679,B2,Stret Light,Design Congress hotel response my analysis soldier act doctor into.,Hi,29-09-2025 12:38,13,Watr Dept,5,Yes,19.228208,73.056983,0.47
C1680,D2,Watr,Cost just military talk Congress paper wonder none increase this.,Hi,20-09-2025 22:27,9,Road Dept,,Yes,19.129638,72.911636,0.28
C1681,D1,Stret Light,Near place official final perhaps visit risk nearly rise book expert.,Hi,06-03-2025 05:00,24,SmartWifiDept,5,No,19.129662,73.097943,0.46
C1682,D1,Trafic,Dream ahead box city security me program cultural choice memory general know.,Med,08-01-2025 08:42,39,Road Dept,5,No,19.269412,73.081202,0.56
C1683,A2,Trafic,Sign central country mission tonight who sing various worry capital race measure you too.,Med,06-12-2025 08:50,91,SmartWifiDept,4,Yes,19.170537,72.80582,0.46
C1684,D2,Trafic,Quite argue dream enjoy name onto manager behind with institution maybe theory southern fall.,Lo,21-03-2025 22:40,88,SmartWifiDept,,Yes,19.100553,73.097012,0.39
C1685,A2,Pollutn,Surface customer beautiful start per certainly expert system agreement piece fact civil.,Med,12-01-2025 21:27,91,Elect Dept,2,No,19.047936,72.816267,0.95
C1686,C2,WiFiIssu,Thank task order who last road glass game what knowledge on.,Hi,24-08-2025 13:31,14,Road Dept,2,No,19.188038,72.938586,0.59
C1687,A2,Pollutn,Understand run along group yeah its nothing well manager late girl we respond pretty week.,Lo,03-02-2025 23:38,75,Clean Dept,3,Yes,19.248999,72.89091,0.36
C1688,D1,Trafic,Mission either school true environmental program growth special street herself agency order.,Hi,05-07-2025 00:20,,SmartWifiDept,1,No,19.294838,72.899901,0.34
C1689,B2,Stret Light,Statement crime food kind join it right standard budget like usually relate sport such director.,,23-02-2025 06:31,,SmartWifiDept,4,No,19.020089,72.996773,0.92
C1690,A2,WiFiIssu,Police huge ago behavior some understand discussion there.,Med,22-07-2025 13:15,,Watr Dept,3,No,19.162602,72.84784,0.14
C1691,A1,WiFiIssu,Never indeed difference training spend owner down more term.,Critcal,07-11-2025 17:25,45,,5,No,19.138091,72.823368,0.48
C1692,D1,Pollutn,Suddenly mouth performance role fall cause clear.,Critcal,04-08-2025 05:24,100,Elect Dept,2,No,19.034025,72.813388,0.24
C1693,C2,Pollutn,Letter either soon similar today pick cause fight individual truth weight thousand network imagine apply avoid.,Med,06-11-2025 18:24,67,SmartWifiDept,10,No,19.079577,72.882008,0.61
C1694,A1,Trafic,Financial hot finish expert policy floor culture religious bit professor property at find quite cold indicate.,Critcal,20-08-2025 00:54,28,Watr Dept,1,No,19.017477,73.007034,0.48
C1695,B2,Pothl,Strong course use sound shake voice short media.,Critcal,24-10-2025 22:23,31,Clean Dept,3,Yes,19.058037,72.940938,0.62
C1696,D2,Watr,Gas green join black up course over break month audience however weight deep.,Lo,10-10-2025 21:46,90,SmartWifiDept,2,Yes,19.27654,72.896667,0.15
C1697,A2,Pothl,Behavior ten bank despite his not try today car speech will.,Hi,06-06-2025 12:52,92,Clean Dept,3,No,19.154664,73.082654,0.74
C1698,A2,Watr,Agency heart top agreement others week these however attention.,Critcal,15-03-2025 02:26,71,SmartWifiDept,1,Yes,19.110519,73.078207,0.31
C1699,C2,Stret Light,Really determine American scientist card kid fact threat before risk control return over nation.,Hi,21-11-2025 00:49,45,SmartWifiDept,2,No,19.281667,72.946789,0.61
C1700,A2,Trafic,Section people school itself later Mrs somebody history.,Hi,04-02-2025 03:11,67,Clean Dept,1,Yes,19.296553,73.068151,0.99
C1701,A1,Stret Light,High soldier plant though national language attack.,,12-10-2025 18:14,4,Clean Dept,3,Yes,19.025706,73.01668,0.38
C1702,B1,Pothl,Fear learn level quality worker off leave.,Med,11-02-2025 04:56,21,SmartWifiDept,,No,19.016348,72.892702,0.81
C1703,A2,WiFiIssu,Recognize capital organization happen point whatever husband throw.,Lo,18-11-2025 07:47,115,,2,No,19.215612,72.96877,0.69
C1704,C2,WiFiIssu,Second all parent ground training time tough tax for space miss crime six teach sometimes human.,Lo,04-07-2025 12:19,,Clean Dept,,No,19.2914,72.91334,0.1
C1705,C1,Trafic,Control with national top build movement those same positive information.,Critcal,15-07-2025 17:15,110,SmartWifiDept,2,No,19.038575,72.988647,0.87
C1706,C1,Pothl,General evening meeting together carry news budget their sit man ground voice owner now successful.,,05-03-2025 02:37,84,SmartWifiDept,,Yes,19.248419,73.002851,0.29
C1707,A1,Watr,Sell employee born western who agent yard.,Lo,24-11-2025 22:25,65,Road Dept,2,Yes,19.148902,72.979126,0.62
C1708,A1,WiFiIssu,Product note many less in wish ask.,Hi,12-07-2025 15:53,53,Elect Dept,4,Yes,19.065435,72.829591,0.86
C1709,D1,Watr,Simple it matter close recent expect subject themselves organization worry pretty argue discuss.,Lo,30-04-2025 10:20,,Road Dept,3,Yes,19.146642,72.975535,0.83
C1710,B2,Trafic,Eight main there actually agent day teach sing.,Med,15-02-2025 00:59,55,Road Dept,5,No,19.14238,73.083851,0.68
C1711,D2,Stret Light,Interesting election financial interest take for agree senior policy mouth night accept realize party.,Lo,21-10-2025 02:22,62,Watr Dept,5,No,19.228755,72.924328,0.95
C1712,A2,Garbge,Near politics south realize network election style provide team meet draw finish enjoy TV.,Lo,11-05-2025 19:46,118,Clean Dept,1,Yes,19.088567,73.051116,0.81
C1713,D1,Trafic,Deep space step Republican reveal goal wrong room.,Lo,13-01-2025 06:13,47,Road Dept,1,No,19.210832,72.81824,0.56
C1714,A1,Watr,Worry eight tax family those meeting phone idea idea value avoid be example.,,10-03-2025 19:03,,SmartWifiDept,5,No,19.074962,72.807018,0.85
C1715,D2,Stret Light,Account eat own fish history former ever the.,Critcal,07-11-2025 10:42,5,Elect Dept,2,No,19.049422,72.898566,0.43
C1716,C2,Pothl,Feel live identify ready better blood talk tax listen word tonight fact human course.,Lo,19-02-2025 15:58,85,Clean Dept,,No,19.189757,73.08552,0.75
C1717,C2,Trafic,Blood wide candidate short low pretty allow church major employee Democrat.,Critcal,06-02-2025 17:12,41,Elect Dept,5,Yes,19.18579,72.867935,0.55
C1718,D1,Garbge,Scientist mean recognize stock a maintain song.,Med,21-11-2025 16:47,69,Clean Dept,,No,19.265622,73.076115,0.54
C1719,C2,Garbge,Catch out miss table investment rate expert even fast.,,31-08-2025 10:02,,Road Dept,3,Yes,19.031396,73.030123,0.02
C1720,A2,Pothl,Move energy president dream history economic PM not third sister wonder employee position responsibility pretty actually.,Med,23-05-2025 02:44,98,,2,Yes,19.161685,72.919922,0.3
C1721,B2,Garbge,Baby friend detail talk piece until film program book rule than pull student.,Hi,05-03-2025 18:33,90,Road Dept,4,No,19.272592,72.844919,0.04
C1722,D2,Trafic,Man heavy method but participant usually according car form front four computer support he.,Med,04-02-2025 17:25,119,SmartWifiDept,5,No,19.019662,72.846757,0.18
C1723,D1,Watr,Question say where guy down water yeah inside fast church deep low sport.,Med,09-02-2025 06:52,64,SmartWifiDept,4,Yes,19.261827,72.993182,0.16
C1724,B1,Watr,Thought because remember tend western wonder act land rate else purpose throughout.,Hi,03-08-2025 11:45,28,Clean Dept,2,Yes,19.05778,72.842825,0.14
C1725,B2,Watr,War early alone certain third total evidence poor much likely society Congress song.,Hi,07-02-2025 23:27,4,Road Dept,2,No,19.040494,72.883748,0.06
C1726,D2,Trafic,Upon before actually sea however world plant character floor sell before race seem.,Lo,19-10-2025 06:39,66,,1,Yes,19.060904,73.072567,0.43
C1727,B1,Garbge,Something south hard table thing already choose friend almost couple fish of under final low.,,14-06-2025 08:51,999,SmartWifiDept,3,No,19.271184,72.820288,0.16
C1728,C2,Garbge,Size son industry good gun choose company at perhaps you identify something poor third.,Critcal,10-05-2025 02:55,59,SmartWifiDept,4,Yes,19.191782,73.059487,0.16
C1729,D2,Stret Light,Appear check hospital office give whom color get.,,04-02-2025 10:09,,Road Dept,,Yes,19.159223,73.01495,0.92
C1730,C1,WiFiIssu,Face court six mouth now president decade take region term operation tonight.,Critcal,31-07-2025 02:51,999,Elect Dept,1,No,19.298583,73.011258,0.43
C1731,B2,Watr,Test produce culture light our tonight he.,Lo,26-05-2025 07:33,59,Elect Dept,3,Yes,19.283299,73.084061,0.63
C1732,A1,Watr,Hot federal mouth imagine character product maintain benefit.,Lo,07-08-2025 04:59,41,Road Dept,4,Yes,19.131658,72.826786,0.4
C1733,A2,Pothl,Share although region grow education arm as positive interest become yeah name machine staff answer.,Hi,18-01-2025 06:44,23,Road Dept,1,No,19.189828,73.074138,0.9
C1734,C1,Watr,Character wide blue hard cover feeling appear guy level pick suggest piece technology decision fight maintain.,,04-08-2025 05:20,108,Road Dept,4,No,19.074384,73.070508,0.22
C1735,B2,WiFiIssu,Country compare I true similar fish easy never recently factor despite so.,Med,12-03-2025 15:46,1,Watr Dept,1,Yes,19.023261,72.933824,0.75
C1736,B1,Trafic,Hope evidence policy put range wear minute everything others public.,Med,02-09-2025 00:40,93,Clean Dept,5,Yes,19.198549,72.843173,0.92
C1737,D2,Trafic,Involve window so woman whole cause military.,Med,08-06-2025 04:53,111,Watr Dept,5,No,19.096679,72.883644,0.96
C1738,B2,Stret Light,Left author sort force phone look join police focus card pay.,Lo,17-05-2025 03:53,67,Clean Dept,5,Yes,19.225224,73.01468,0.33
C1739,C2,Stret Light,Manage share just edge good blood on share real respond audience use quite.,Med,04-09-2025 22:09,2,,2,No,19.108634,73.087961,0.03
C1740,C2,WiFiIssu,Few lay after fact unit memory authority spend give month institution enjoy how eat side I.,Med,09-01-2025 22:35,5,SmartWifiDept,5,No,19.247181,72.827162,0.39
C1741,D1,Trafic,Benefit central across pass fear way his leave clear Republican state field yes father.,Med,06-03-2025 21:16,97,Watr Dept,1,No,19.10793,72.990297,0.54
C1742,A2,Watr,Final politics pass fact test security positive often history occur analysis leader tree commercial.,Hi,16-11-2025 21:21,114,,4,No,19.245328,72.988513,0.19
C1743,B1,Watr,Hour step campaign know reveal receive bit to need teacher talk again enter quality choice.,Critcal,03-06-2025 20:39,20,Elect Dept,2,No,19.065145,72.825204,0.83
C1744,C1,WiFiIssu,East manager close daughter never remain truth management decision customer source market after edge vote cover.,Lo,18-04-2025 09:43,89,SmartWifiDept,4,Yes,19.218237,72.976593,0.2
C1745,B2,Watr,Home perhaps speech third government clearly raise.,Lo,04-11-2025 06:38,17,SmartWifiDept,2,No,19.174008,72.985279,0.26
C1746,D1,Pothl,Some strategy campaign offer success foot church yourself beat east speech.,Med,15-09-2025 15:13,83,SmartWifiDept,,Yes,19.164419,73.018405,0.15
C1747,A1,Pothl,Education upon run west agency happen both near.,,26-05-2025 18:15,37,SmartWifiDept,3,Yes,19.021872,72.991526,0.64
C1748,A1,WiFiIssu,Hour child range change three where figure home.,Lo,22-08-2025 13:15,1,Elect Dept,1,No,19.212467,73.063069,0.56
C1749,B1,Pollutn,Dream impact similar idea standard risk focus hotel nothing doctor section.,Critcal,09-03-2025 11:54,78,SmartWifiDept,4,Yes,19.105248,72.853055,0.32
C1750,A1,Trafic,Dinner future hit medical collection expert understand contain realize its star perhaps sort drive person.,Lo,29-08-2025 11:08,59,Clean Dept,3,Yes,19.242716,72.892223,0.09
C1751,C2,Stret Light,Great local first and real story key institution easy east.,Lo,11-01-2025 15:56,52,Watr Dept,5,No,19.136865,72.961186,0.42
C1752,C2,Trafic,Black guess but result yeah she them lead within.,Med,06-04-2025 04:19,102,Clean Dept,,No,19.187499,73.063108,0.37
C1753,C1,Trafic,Boy leave raise fact determine discuss evidence.,Critcal,15-04-2025 20:18,29,SmartWifiDept,4,No,19.223594,72.925284,0.56
C1754,B2,Pollutn,Room choice value get indeed face current president today reduce their catch.,Critcal,13-11-2025 20:02,56,Watr Dept,4,No,19.199161,73.044316,0.04
C1755,A2,Pollutn,Study table cell part particularly artist pass important.,Hi,29-08-2025 05:30,22,,,Yes,19.078312,72.985988,0.52
C1756,A1,Trafic,Dark argue smile Mrs air parent table bit federal behavior improve including.,Hi,09-10-2025 18:21,70,SmartWifiDept,3,Yes,19.201309,72.910361,0.3
C1757,C2,Trafic,Country food fast story deal let low those have news.,Lo,17-11-2025 01:44,13,SmartWifiDept,5,Yes,19.038106,72.870096,0.9
C1758,A1,Stret Light,Add recognize enjoy use few sound positive nor focus better too with treat skill.,Med,10-12-2025 00:44,20,Elect Dept,3,No,19.119544,73.026153,0.97
C1759,A1,Trafic,Worry course miss computer plant more quality politics great country by effect.,Lo,28-01-2025 18:33,,Watr Dept,2,Yes,19.248988,73.033505,0.92
C1760,B1,Stret Light,Cause suddenly determine network three end soldier oil while fast ball.,Hi,29-09-2025 22:05,55,,3,Yes,19.263244,72.911158,0.75
C1761,C2,Trafic,Theory these general role level player audience give money lay why minute energy.,Lo,28-08-2025 02:14,52,Elect Dept,3,No,19.041974,72.945442,0.86
C1762,D2,Stret Light,Some nature believe commercial site perform one information appear.,Med,02-09-2025 14:37,,Watr Dept,,No,19.292895,72.914602,0.15
C1763,D1,Pothl,Tax lead general see official even above understand relationship charge how support.,,03-10-2025 22:18,88,Elect Dept,5,No,19.044552,73.051223,0.6
C1764,D2,Watr,American much learn ask customer sometimes indeed war scientist out laugh paper.,Hi,28-04-2025 09:06,25,Clean Dept,1,No,19.209677,73.058602,0.65
C1765,A2,Stret Light,Community among that prevent paper type main institution poor discover someone.,Hi,12-04-2025 05:10,111,Clean Dept,4,No,19.063782,73.099797,0.97
C1766,D2,Trafic,Lose off chair here compare more remember last or gun model.,Hi,12-07-2025 20:44,102,Road Dept,,No,19.284741,72.917492,0.53
C1767,B1,Trafic,Thought property watch continue lot stage cost should instead position.,Lo,09-04-2025 20:01,4,Road Dept,4,No,19.248294,72.958977,0.89
C1768,C1,Stret Light,Practice relate forward country purpose student music dark blue game surface let worker which.,,31-01-2025 16:41,,Road Dept,2,Yes,19.090154,72.864873,0.68
C1769,D2,Pollutn,Protect treatment job leave little lawyer service outside.,,22-01-2025 01:45,88,SmartWifiDept,1,No,19.079508,73.008225,0.27
C1770,D2,Trafic,Subject cell other your she miss everyone.,Critcal,19-03-2025 16:53,38,Clean Dept,3,Yes,19.178496,72.818407,0.36
C1771,B2,Stret Light,Hard medical forget treat person human attention send forget north front threat something well experience.,Lo,21-07-2025 13:19,44,SmartWifiDept,5,No,19.019646,72.830084,0.23
C1772,D1,WiFiIssu,Task scene represent live oil top make draw manager modern half determine vote.,Med,05-08-2025 20:10,97,,4,No,19.186054,72.976146,0.69
C1773,D1,Pollutn,So class meeting source million risk white law from either.,Med,05-04-2025 19:06,113,Road Dept,2,Yes,19.123092,72.863135,0.89
C1774,B1,Garbge,Out test building can chance choose these agreement generation for minute story for.,,02-08-2025 04:44,68,Watr Dept,5,No,19.103364,72.816115,0.85
C1775,B1,Pollutn,Dinner near this test stock deal appear nearly ever goal public thus still garden enjoy.,Hi,28-01-2025 09:52,110,Elect Dept,1,No,19.161762,72.877681,0.66
C1776,C2,Trafic,Message into assume fall player business process herself left rather be north total.,,03-02-2025 01:37,37,,4,No,19.210274,73.08932,0.92
C1777,C1,Pollutn,Play class good effect her stop police determine important authority smile style consider.,Med,10-03-2025 04:51,81,Road Dept,1,Yes,19.268716,72.979139,0.86
C1778,B1,Pothl,Pass director development green name clearly official black under.,Lo,02-08-2025 16:09,71,Road Dept,4,Yes,19.175041,72.866572,0.88
C1779,C1,Pothl,Cost interesting month tend son woman able myself resource quality those stuff father.,Med,25-01-2025 11:11,83,,3,Yes,19.098296,72.977901,0.19
C1780,C1,Stret Light,Open talk different political we assume really least hot school husband consumer.,Critcal,08-06-2025 03:35,28,Clean Dept,1,No,19.266537,72.992538,0.67
C1781,C1,Watr,Once action everything young sport sport send under if.,Lo,09-12-2025 05:58,89,SmartWifiDept,,No,19.20892,72.94943,0.54
C1782,A1,Garbge,Worry this thing nice blue meeting sell.,Hi,10-12-2025 09:47,,Elect Dept,1,Yes,19.281334,72.814944,0.5
C1783,D1,Trafic,There more carry good point series nothing.,Med,13-02-2025 06:02,52,Road Dept,1,No,19.19296,72.899567,0.87
C1784,B1,Pothl,Congress kid picture body certain if use least head.,Lo,09-08-2025 07:00,110,Watr Dept,3,Yes,19.182329,72.922156,0.8
C1785,C2,Watr,Instead up doctor enter material commercial method around environmental player student current myself green day various.,Lo,21-09-2025 04:43,101,Road Dept,5,Yes,19.105802,73.043666,0.11
C1786,C2,Stret Light,Prepare character section early song from once way teacher station more teacher.,Critcal,10-10-2025 00:22,107,Elect Dept,4,No,19.241283,72.976158,0.79
C1787,A2,Garbge,Among fight area miss impact eat through use win stock check lawyer production out.,Hi,06-08-2025 08:40,,Clean Dept,2,No,19.230534,72.812079,0.59
C1788,A1,Pollutn,Create likely drop hotel record tend ask board project good significant themselves.,Hi,21-05-2025 21:32,103,Road Dept,1,Yes,19.220426,72.939428,0.02
C1789,D2,Stret Light,Hotel consider next give film glass act suggest try laugh.,Hi,19-08-2025 18:39,19,Road Dept,5,Yes,19.080988,72.889085,0.75
C1790,B1,Stret Light,Sister camera answer leave every science land report fight two news various feeling leader source really.,Critcal,20-10-2025 18:19,59,Road Dept,5,No,19.036472,72.988977,0.93
C1791,A1,WiFiIssu,Community industry newspaper college break news catch manager friend military treatment political.,Med,01-05-2025 16:54,33,Watr Dept,2,Yes,19.280854,72.80832,0.27
C1792,B1,Pollutn,Certain bad usually country prevent question be society.,Lo,28-06-2025 07:14,58,SmartWifiDept,4,Yes,19.174761,73.062329,0.77
C1793,C1,Trafic,List environmental carry up why debate through.,Critcal,01-05-2025 09:53,117,SmartWifiDept,2,Yes,19.141334,72.841589,0.05
C1794,C1,Trafic,Couple firm operation game send morning reduce stand whom.,Critcal,17-06-2025 06:47,111,SmartWifiDept,1,Yes,19.271648,72.826588,0.46
C1795,C2,Watr,Floor notice movement role turn type good throw computer need political blood boy cell oil.,Hi,13-06-2025 00:58,15,Road Dept,2,No,19.209287,72.937562,0.47
C1796,A1,Pollutn,Place push turn society note usually former I challenge represent.,Hi,09-01-2025 06:36,16,Watr Dept,2,No,19.255214,72.892472,0.85
C1797,D1,Garbge,Suffer own practice source poor suffer leader central will nor which military material.,Lo,25-04-2025 15:03,34,Watr Dept,5,Yes,19.059178,73.041968,0.81
C1798,B2,WiFiIssu,Push attack movie part million second however toward expect partner.,Critcal,13-04-2025 16:26,63,SmartWifiDept,1,Yes,19.190417,72.808826,0.37
C1799,C2,Watr,Including factor week husband beat message decade away seven specific TV all Congress hand.,Hi,19-10-2025 15:16,34,Clean Dept,5,No,19.249024,72.930256,0.48
C1800,A2,Trafic,Ahead wish concern military management member social.,Critcal,03-08-2025 23:50,,Clean Dept,3,No,19.135926,72.880084,0.81
C1801,B1,Trafic,Rest so southern product boy various when here upon age at friend early parent whatever.,Critcal,26-04-2025 19:46,84,Clean Dept,5,No,19.233395,72.992077,0.72
C1802,B1,Stret Light,Difference score community care paper no prepare.,Lo,03-04-2025 07:49,69,SmartWifiDept,1,No,19.241173,73.059086,0.4
C1803,B1,Trafic,American sport parent shake want read conference whether anything detail particularly.,Critcal,16-07-2025 15:32,108,Clean Dept,5,No,19.057906,72.969233,0.97
C1804,A2,Trafic,Deep six threat fine job answer international plan school cause arm control name.,Lo,23-02-2025 17:57,28,Clean Dept,1,No,19.254911,72.803385,0.92
C1805,D2,Trafic,Clear modern never operation mean up clearly bag soldier visit six list treatment issue there operation.,Lo,11-08-2025 02:41,102,Watr Dept,4,Yes,19.098234,72.896564,0.77
C1806,C1,Pollutn,Morning interesting training right true physical want call our whatever stage leave product cup world.,Critcal,09-05-2025 13:36,55,Elect Dept,4,Yes,19.094483,73.093399,0.51
C1807,B1,Pollutn,Risk southern couple truth especially modern yourself activity citizen accept.,,30-10-2025 09:07,67,Road Dept,4,Yes,19.206314,72.92849,0.95
